NoUtilisateur,Parution,Categorie,DescriptionAbregee,DescriptionComplete,Prix,Photo,MiseAJour,Etat
1,2024-03-01 12:00:00,3,Vélo de montagne à vendre,Vélo de montagne en excellent état peu utilisé. Marque Trek.,399.99,photos-annonce/velo.jpg,2024-03-01 12:00:00,1
2,2024-03-02 14:30:00,1,Appartement à louer,Bel appartement 3 1/2 à louer quartier tranquille.,800.00,photos-annonce/appartement.jpg,2024-03-02 14:30:00,1
3,2024-03-03 10:00:00,5,Cours de guitare,Offre des cours de guitare pour débutants et intermédiaires.,25.00,photos-annonce/cours_guitare.jpg,2024-03-03 10:00:00,1
1,2023-12-01 09:00:00,2,Ordinateur portable à vendre,Ordinateur portable en bon état peu utilisé.,599.99,photos-annonce/ordinateur.jpg,2023-12-01 09:00:00,3
2,2023-11-15 11:30:00,4,Livres gratuits,Lot de livres à donner en bon état.,0.00,photos-annonce/livres.jpg,2023-11-15 11:30:00,3
2,2023-11-15 11:30:00,4,Livres gratuits,Lot de livres à donner en bon état.,0.00,photos-annonce/livres.jpg,2023-11-15 11:30:00,1